nome,preco
Patricia Abravanel Intenso Desodorante Colônia Feminina 100 ml,"R$ 110,42"
"Batom Cremoso Ellas Candy Rosa, 3,5 g","R$ 8,42"
"Shampoo Sensi Hidratacao e Maciez, 250 ml","R$ 13,52"
Desodorante Aerossol Antitranspirante Sensi Men Extra Fresh 150 ml/90 g,"R$ 19,46"
Desodorante Antitranspirante Sensi Suave Aerossol Feminino 1 un,"R$ 14,36"
"Desodorante Antitranspirante Aerossol Masculino Sensi Antibac, 150ml/90 g","R$ 14,36"
Desodorante Roll-On Antitranspirante Sensi Sem Perfume 65 ml,"R$ 11,82"
Desodorante Aerossol Antitranspirante Sensi Men Play - 150 ml/90 g,"R$ 19,46"
Kit de Desodorantes Aerossol Antitranspirante Sensi Men 10 un,"R$ 149,90"
Desodorante Aerossol Antitranspirante Sensi Delicado 150 ml,"R$ 14,36"
"Desodorante Antitranspirante Aerossol Sensi Antibac, 150ml/90g","R$ 14,36"
Desodorante Roll-On Antitranspirante Sensi Conforto 65 ml,"R$ 11,82"
Desodorante Antitranspirante Roll-On Algodão Sensi 55 ml,"R$ 16,06"
Desodorante Roll-On Antitranspirante Sensi Erva Doce 65 ml,"R$ 15,22"
Desodorante Antitranspirante Sensi Men Cool Ice Aerossol Masculino 1 un,"R$ 14,36"
"Desodorante Antitranspirante Roll-On Sensi Men Sport, 55 ml","R$ 11,82"
Desodorante Antitranspirante Roll On Masculino Sensi Men Cool Ice Jequiti 55 ml,"R$ 11,82"
Desodorante Roll-on Antitranspirante Sensi Men Impacto - 55 ml,"R$ 11,82"
Kit de Desodorantes Aerossol Antitranspirante Sensi Men Extra Fresh 5 un,"R$ 74,90"
